<santa xmlns:xsi="http://www.w3.org/2001/XMLSchema-instance"
       xsi:noNamespaceSchemaLocation="santa.xsd">
    <replicates>1</replicates>

    <simulation>
        <genome>
            <length>999</length>
	        <sequences>
		        AGTGAAGAAGAGGTAGTAATTAGATCTGAAAATTTCACGGACAATGCTAAAACCATAATAGTACAGCTGAAGGAGTCTGTAGTAATTAATTGTACAAGACCCAATAACAATACAAGAAAAAGTATACAGGTAGGACCAGGGAAAGCAATTTATACAACAGGAGAAATAATAGGAGATTTAAGACAAGCACATTGTAACCTTAGTAGAGCAGAATGGAATAACACTTTAAAACAGATAGTTAAGAAATTAAGAGAACAATTTGGGAATAAAACAATAGTCTTTAATCAATCCTCAGGAGGGGACCCAGAAATTGTAATGCACAGTTTGAATTGTAGAGGGGAATTTTTCTACTGTAATTCAACACAACTGTTTAATAGTACTTGGGATAATAGTACTTTGAATAATGTTACTGAAGGGTCAAATAGCACTGAAGAGAATATCACACTCCCATGCAGAATAAAACAAATTATAAACATGTGGCAGGAAGGAAAAGCAATGGTATATGCCCCTCCCATCAGAGGACAAATTAGATGTTCATCAAATATTACAGGGCTGCTATTAACAAGAGATGGTGGTAAGGACACGAGCAATACCGAAATCTTCAGACCTGGAGAAGAAGAGGTAGTAATTAGATCTGAAAATTTCACGGACAATGCTAAAACCATAATAGTACAGCTGAAGGAGTCTGTAGTAATTAATTGTACAAGACCCAATAACAATACAAGAAAAAGTATACAGGTAGGACCAGGGAAAGCAATTTATACAACAGGAGAAATAATAGGAGATTTAAGACAAGCACATTGTAACCTTAGTAGAGCAGAATGGAATAACACTTTAAAACAGATAGTTAAGAAATTAAGAGAACAATTTGGGAATAAAACAATAGTCTTTAATCAATCCTCAGGAGGGGACCCAGAAATTGTAATGCACAGTTTGAATTGTAGAGGGGAATTTTTCTACTGTAATTCAACACAACTGTTTAATAGTACTTGGGATAAT
	        </sequences>
	        <feature>
		        <name>CDS</name>
		        <type>aminoAcid</type>
		        <coordinates>1-999</coordinates>
	        </feature>
        </genome>

        <population>
            <populationSize>1000</populationSize>

            <inoculum>all</inoculum>
        </population>

        <fitnessFunction>
            <purifyingFitness>
	            <feature>CDS</feature>
                <sites>1-166,168-333</sites>
                <rank>
                	<order>observed</order>
                    <breakTies>random</breakTies>
                </rank>
                <fitness>
	                <lowFitness>0.5</lowFitness>
                    <minimumFitness>0.5</minimumFitness>
                </fitness>
            </purifyingFitness>
            <purifyingFitness>
	            <feature>CDS</feature>
                <sites>167</sites>
                <rank>
                    <order>VL</order>
                    <breakTies>random</breakTies>
                </rank>
                <fitness>
	                <lowFitness>0.1</lowFitness>
                    <minimumFitness>0.0</minimumFitness>
                </fitness>
                <fluctuate>
                    <rate>$rate</rate>
                    <fitnessLimit>0.1</fitnessLimit>
                </fluctuate>
            </purifyingFitness>
        </fitnessFunction>

        <mutator>
            <nucleotideMutator>
                <mutationRate>2.5E-4</mutationRate>
                <transitionBias>2.0</transitionBias>
            </nucleotideMutator>
        </mutator>

        <replicator>
            <recombinantReplicator>
                <dualInfectionProbability>$dual</dualInfectionProbability>
                <recombinationProbability>0.001</recombinationProbability>
            </recombinantReplicator>

        </replicator>

        <epoch>
            <generationCount>1000000</generationCount>
        </epoch>

        <samplingSchedule>
            <sampler>
                <atFrequency>1000</atFrequency>
                <fileName>alignment_%r.nex</fileName>
                <alignment>
                    <sampleSize>100</sampleSize>
                    <format>NEXUS</format>
                    <label>seq_%g_%s</label>
                </alignment>
            </sampler>
            <sampler>
                <atFrequency>1000</atFrequency>
                <fileName>aa_frequencies.csv</fileName>
                <alleleFrequency>
	                <feature>CDS</feature>
                </alleleFrequency>
            </sampler>
            <sampler>
                <atFrequency>1000</atFrequency>
                <fileName>nt_frequencies.csv</fileName>
                <alleleFrequency>
                    <sites>1-999</sites>
                </alleleFrequency>
            </sampler>
            <sampler>
                <atFrequency>1</atFrequency>
                <fileName>stats.csv</fileName>
                <statistics></statistics>
            </sampler>
        </samplingSchedule>

    </simulation>

</santa>
