<santa xmlns:xsi="http://www.w3.org/2001/XMLSchema-instance"
	xsi:noNamespaceSchemaLocation="santa.xsd">

  <!-- Using run-time parameters -->

  <!-- The configuration file supports the use of parameters, for which -->
  <!-- values may be defined at run time. This may be done for all numberic -->
  <!-- configuration parameters. Parameters must start with a '$' sign. -->
  <replicates>$replicates</replicates>

  <simulation>
    <genome>
      
      <length>210</length>
      
      <sequences>
> HIV-1.POL_0_|0|0|0
ATGAGTTTGCCAGGAAGATGGAAACCAAAAATGATAGGGGGAATTGGAGGTTTTATCAAAGTAAGACAGT
ATGATCAGATACTCATAGAAATCTGTGGACATAAAGCTATAGGTACAGTATTAGTAGGACCTACACCTGT
CAACATAATTGGAAGAAATCTGTTGACTCAGATTGGTTGCACTTTAAATTTTCCCATTAGCCCTATTGAG
      </sequences>
      <feature>
      	<name>PR</name>
      	<type>aminoAcid</type>
      	<coordinates>27-62</coordinates>
      </feature>
      <feature>
      	<name>CDS</name>
      	<type>aminoAcid</type>
      	<coordinates>61-123</coordinates>
      </feature>
    </genome>

    <population>
      <populationSize>$population</populationSize>
      <inoculum>all</inoculum>
    </population>
    <populationType>staticPopulation</populationType>

    <fitnessFunction>
      <purifyingFitness>
      	<feature>CDS</feature>
        <sites>1</sites>
        <rank>
          <order>chemical</order>
          <breakTies>random</breakTies>
        </rank>
        <fitness>
          <lowFitness>0.9</lowFitness>
      	  <minimumFitness>0.1</minimumFitness>
        </fitness>
      </purifyingFitness>
      <!-- <purifyingFitness> -->
      <!-- 	<feature>CDS</feature> -->
      <!--   <sites>10-20</sites> -->
      <!--   <rank> -->
      <!--     <order>chemical</order> -->
      <!--     <breakTies>random</breakTies> -->
      <!--   </rank> -->
      <!--   <fitness> -->
      <!--     <lowFitness>0.9</lowFitness> -->
      <!-- 	  <minimumFitness>0.1</minimumFitness> -->
      <!--   </fitness> -->
      <!-- </purifyingFitness> -->
      <!-- <populationSizeDependentFitness> -->
      <!-- 	<feature>PR</feature> -->
      <!-- 	<sites>1-30</sites> -->
      <!-- 	<declineRate>0.005</declineRate> -->
      <!-- 	<maxPopulationSize>50000</maxPopulationSize> -->
      <!-- </populationSizeDependentFitness> -->
      <!-- <exposureDependentFitness> -->
      <!-- 	<feature>CDS</feature> -->
      <!-- 	<sites>1-5</sites> -->
      <!-- 	<penalty>0.01</penalty> -->
      <!-- </exposureDependentFitness> -->

    </fitnessFunction>

    <!-- Mutations occur as an independent process after replication,
         The user specifies a per-site and per-generation probability
         of mutation, and the mutator component then applies mutations
         to the genome accordingly. For efficiency, the default
         mutator draws the number of mutations from a Poisson
         distribution with an expectation given by the number of
         nucleotides and the rate. These are then distributed
         uniformly across sites. A bias towards transition-type
         mutations can be specified to reflect the action of some
         polymerases, or all 12 relative rates biases may be specified
         -->
    <mutator>
      <nucleotideMutator>
	<mutationRate>2.5e-5</mutationRate>

	<!-- Negative Binomial
	     Geometric insertion length distribution (q=0.4, r=1) -->
	<indelmodel model="NB">0.4 1</indelmodel>
	<insertprob>2.5E-1</insertprob>
	<deleteprob>2.5E-1</deleteprob>
	<!-- Negative binomial
	     Pascal insertion length distribution (q=0.2, r=4) -->
	<!-- <delete model="NB">0.2 4</delete> -->	
	<rateBias>
	  0.42 2.49 0.29
	  1.73 0.23 4.73
	  6.99 0.20 0.60
	  1.02 2.56 0.88
	</rateBias>
      </nucleotideMutator>
    </mutator>
    <replicator>
      <recombinantReplicator>
      	<dualInfectionProbability>0.99</dualInfectionProbability>
      	<recombinationProbability>0.01</recombinationProbability>
      </recombinantReplicator>
      <!-- <clonalReplicator/> -->
    </replicator>

    <epoch>
      <name>initial</name>
      <generationCount>$generations</generationCount>			
    </epoch>
    
    <samplingSchedule>
      <sampler>
      	<atGeneration>1</atGeneration>
      	<fileName>trees_%r.tree</fileName>
      	<tree>
      	  <sampleSize>5</sampleSize>
      	  <format>NEXUS</format>
      	  <label>tip_%g_%s</label>
      	</tree>
      </sampler>
      <sampler>
	<atFrequency>1</atFrequency>	
	<fileName>sequences_%r.fa</fileName>
	<alignment>
	  <sampleSize>$samplesize</sampleSize>
	  <format>FASTA</format>
	  <label>sequence_%g_%s|hiv_pol.fa|0|0</label>
	</alignment>
      </sampler>
      <sampler>
      	<atFrequency>1</atFrequency>
      	<fileName>genomes_%r.tsv</fileName>
      	<genomedescription>
      	  <sampleSize>10000</sampleSize>
      	  <label>genome_%g_%s</label>
      	</genomedescription>
      </sampler>
    </samplingSchedule>

    <eventLogger>
      <fileName>events.txt</fileName>
    </eventLogger>
  </simulation>
</santa>
